{
  "$schema": "schema/expedition_events.schema.json",
  "$comment": "События экспедиций — «текстовые приключения» (docs/design/expedition-adventures.md). perExpedition — сколько событий за срок; tiers — доля «куска» базовой добычи (снимок золота и опыта / число событий) по ступеням. locations пусто — общее событие. Вариант default: без требований, шанс 1, награда none (прежняя добыча). requires: line (класс), role или hero (id карточки) — с таким героем шанс chanceWith, без — chance. В текстах: {hero}, {partner}, [мужской|женский]. id событий лежат в сохранениях — не переименовывать.",
  "perExpedition": [
    {
      "maxHours": 1,
      "count": 1
    },
    {
      "maxHours": 4,
      "count": 2
    },
    {
      "maxHours": 1000,
      "count": 3
    }
  ],
  "tiers": {
    "none": 0,
    "small": 0.12,
    "medium": 0.24,
    "big": 0.4,
    "loss": -0.1
  },
  "journalMax": 40,
  "localWeight": 2,
  "events": [
    {
      "id": "ant_caravan_crate",
      "title": "Ящик каравана",
      "locations": [
        "ant_hell"
      ],
      "text": "Рабочие муравьи тащат по ходу ящик с печатью моррокского каравана. Ящик больше них втрое, и они явно этим гордятся. Внутри что-то звякает — золото или посуда.",
      "choices": [
        {
          "id": "pick",
          "label": "Вор: вскрыть на ходу",
          "requires": {
            "line": [
              "thief"
            ]
          },
          "chance": 0.35,
          "success": {
            "text": "{hero} на бегу поддевает крышку и вытряхивает монеты, пока муравьи спорят, кто несёт угол.",
            "reward": "medium"
          },
          "fail": {
            "text": "Замок оказался с секретом, а муравьи — с жвалами. Отряд отступает с пустыми руками и покусанными пальцами.",
            "reward": "loss"
          }
        },
        {
          "id": "fight",
          "label": "Отбить ящик силой",
          "chance": 0.55,
          "success": {
            "text": "Муравьи бросают ношу и уходят за подмогой. В ящике — жалованье погонщиков и чья-то дорожная обувь.",
            "reward": "small",
            "item": true
          },
          "fail": {
            "text": "На шум сбегается полмуравейника. Ящик уезжает вглубь, а {hero} — с укусом на память.",
            "reward": "loss",
            "wound": true
          }
        },
        {
          "id": "let",
          "label": "Пропустить процессию",
          "chance": 1,
          "default": true,
          "success": {
            "text": "Отряд прижимается к стене. Ящик проплывает мимо, звякая, как насмешка."
          }
        }
      ]
    },
    {
      "id": "ant_egg_hall",
      "title": "Зал яиц",
      "locations": [
        "ant_hell"
      ],
      "text": "Тёплый зал, до потолка заставленный белыми яйцами. Андре-няньки ходят между рядами и трогают каждое усиком. Посреди зала лежит сумка пропавшего искателя.",
      "choices": [
        {
          "id": "sneak",
          "label": "Лучник: снять нянек издали",
          "requires": {
            "line": [
              "archer"
            ]
          },
          "chance": 0.35,
          "success": {
            "text": "{hero} гасит двух нянек тихими выстрелами. Сумка — у отряда: в ней кошелёк и дневник с картой ходов.",
            "reward": "medium",
            "lore": "В дневнике пропавшего искателя: «Муравьи не злые. Просто очень заняты»."
          },
          "fail": {
            "text": "Стрела звенит о скорлупу. Весь зал поворачивает усики к отряду, приходится уносить ноги.",
            "reward": "loss"
          }
        },
        {
          "id": "crawl",
          "label": "Проползти между рядами",
          "chance": 0.6,
          "success": {
            "text": "{hero} ползёт между яйцами, не дыша, и возвращается с сумкой. Одно яйцо, кажется, ему подмигнуло.",
            "reward": "small"
          },
          "fail": {
            "text": "Хрусть. Скорлупа под коленом. Няньки поднимают писк, и отряд уходит без сумки."
          }
        },
        {
          "id": "skip",
          "label": "Не тревожить гнездо",
          "chance": 1,
          "default": true,
          "success": {
            "text": "Отряд обходит зал по дальнему ходу. Сумка остаётся ждать кого-то посмелее."
          }
        }
      ]
    },
    {
      "id": "ant_deniro_toll",
      "title": "Сборщик Дениро",
      "locations": [
        "ant_hell"
      ],
      "text": "В узком ходу сидит огромный Дениро и не пускает дальше. Перед ним — горка чужих медяков и пуговиц. Похоже, здесь берут пошлину.",
      "choices": [
        {
          "id": "haggle",
          "label": "Торговец: сбить цену",
          "requires": {
            "line": [
              "merchant"
            ]
          },
          "chance": 0.35,
          "success": {
            "text": "{hero} полчаса торгуется с муравьём на языке жестов. Дениро в итоге сам доплачивает — за пуговицы.",
            "reward": "medium",
            "lore": "Муравьи Сограта принимают пуговицы как монету. Курс — плавающий."
          },
          "fail": {
            "text": "Дениро не понял шутки про оптовую скидку и откусил кошелёк целиком.",
            "reward": "loss"
          }
        },
        {
          "id": "pay",
          "label": "Заплатить пуговицами",
          "chance": 0.7,
          "success": {
            "text": "Пуговицы приняты. Дениро отодвигается и даже показывает короткий ход к старому складу.",
            "reward": "small"
          },
          "fail": {
            "text": "Пуговиц не хватило. Приходится отдать ещё и медяки.",
            "reward": "loss"
          }
        },
        {
          "id": "back",
          "label": "Искать обход",
          "chance": 1,
          "default": true,
          "success": {
            "text": "Обход занимает час, зато никто не лишился пуговиц."
          }
        }
      ]
    },
    {
      "id": "ant_queen_song",
      "title": "Песня под землёй",
      "locations": [
        "ant_hell"
      ],
      "text": "Из глубины идёт гул, похожий на колыбельную. Стены дрожат в такт. Муравьи замирают и слушают — все разом, как солдаты на построении.",
      "choices": [
        {
          "id": "listen",
          "label": "Послушник: понять напев",
          "requires": {
            "line": [
              "acolyte"
            ]
          },
          "chance": 0.35,
          "success": {
            "text": "{hero} закрывает глаза и слушает. Напев про песок, воду и дом. Муравьи, похоже, признают отряд своим и пропускают к кладовой.",
            "reward": "medium",
            "lore": "Говорят, Королева муравьёв поёт выводку. Кто услышал песню — того рабочие не трогают до заката."
          },
          "fail": {
            "text": "{hero} пытается подпеть. Тысяча усиков поворачивается к отряду. Уходим. Быстро.",
            "reward": "loss"
          }
        },
        {
          "id": "loot",
          "label": "Обыскать ходы, пока тихо",
          "chance": 0.6,
          "success": {
            "text": "Пока муравьи слушают, отряд пробегает по кладовым и набивает карманы.",
            "reward": "small"
          },
          "fail": {
            "text": "Песня кончилась раньше, чем мешки наполнились."
          }
        },
        {
          "id": "wait",
          "label": "Переждать и идти дальше",
          "chance": 1,
          "default": true,
          "success": {
            "text": "Гул стихает. Отряд продолжает путь, напевая себе под нос.",
            "lore": "В Муравейнике есть час, когда все муравьи замирают и слушают глубину."
          }
        }
      ]
    },
    {
      "id": "payon_bone_dice",
      "title": "Кости в кости",
      "locations": [
        "payon_cave"
      ],
      "text": "У костра сидят три скелета-солдата и играют в кости — своими же фалангами. Банк на кону — горсть старых монет Пайона. Один приглашающе стучит по камню.",
      "choices": [
        {
          "id": "cheat",
          "label": "Вор: подменить кость",
          "requires": {
            "line": [
              "thief"
            ]
          },
          "chance": 0.35,
          "success": {
            "text": "{hero} незаметно подкидывает «счастливую» фалангу. Скелеты проигрывают банк и долго чешут черепа.",
            "reward": "medium"
          },
          "fail": {
            "text": "Скелет замечает лишнюю кость. Мертвецы обижаются по-настоящему.",
            "reward": "loss",
            "wound": true
          }
        },
        {
          "id": "play",
          "label": "Сыграть честно",
          "chance": 0.5,
          "success": {
            "text": "Удача на стороне живых. {hero} сгребает банк и вежливо откланивается.",
            "reward": "small"
          },
          "fail": {
            "text": "Мертвецы играют веками — и это заметно. Отряд уходит легче на кошелёк.",
            "reward": "loss"
          }
        },
        {
          "id": "bow",
          "label": "Поклониться и пройти",
          "chance": 1,
          "default": true,
          "success": {
            "text": "Скелеты стучат зубами вслед — наверное, смеются."
          }
        }
      ]
    },
    {
      "id": "payon_hunter_cache",
      "title": "Схрон охотника",
      "locations": [
        "payon_cave"
      ],
      "text": "На стене — зарубки пайонских охотников: «здесь», «глубже», «не ходи». Под последней зарубкой — щель, из которой тянет холодом и оружейным маслом.",
      "choices": [
        {
          "id": "read",
          "label": "Лучник: прочесть знаки",
          "requires": {
            "line": [
              "archer"
            ]
          },
          "chance": 0.35,
          "success": {
            "text": "{hero} читает зарубки как письмо: схрон обойдён ловушкой слева. Внутри — оружие павшего охотника.",
            "reward": "medium",
            "item": true,